,MCQ,Choices,Correct
0,What is the primary goal of unsupervised learning in machine learning?,a : To predict a target variable based on input features | b : To learn the underlying structure or distribution in the data in order to perform prediction or classification tasks | c : To develop a model that can classify new observations into predefined categories | d : To develop a model that can predict the continuous output variable based on one or more input variables,b
1,Which of the following is a disadvantage of using decision trees in machine learning?,a : They are computationally expensive | b : They tend to overfit the training data | c : They require a large amount of labeled data for training | d : They are not suitable for sequential or time-series data,b
2,What does the term 'generalization' refer to in the context of machine learning?,a : The ability of a model to accurately predict outcomes for unseen data | b : The process of reducing the size of a model to improve its efficiency | c : The ability of a model to perform well on a wide range of tasks | d : The degree to which a model is affected by slight changes in the input data,a
3,Which algorithm is best suited for multi-class classification problems?,a : k-Nearest Neighbors | b : Logistic Regression | c : Support Vector Machines | d : Random Forest,c
4,What is the purpose of regularization in machine learning?,a : To increase the complexity of the model | b : To prevent overfitting by adding a penalty to the loss function | c : To reduce the number of features in the model | d : To improve the interpretability of the model,b
5,Which technique is used to evaluate the performance of a machine learning model?,a : Data augmentation | b : Cross-validation | c : Feature scaling | d : Hyperparameter tuning,b
